
{
  "$schema": "https://json-schema.org/draft/2020-12/schema",
  "title": "Voice Transcript Schema",
  "description": "Standard structure for storing speech-to-text transcripts from AI HR screening conversations.",
  "type": "object",
  "additionalProperties": false,
  "required": [
    "transcript_id",
    "candidate_id",
    "job_id",
    "question_id",
    "timestamp",
    "language",
    "transcript_text",
    "confidence"
  ],
  "properties": {
    "transcript_id": {
      "type": "string",
      "minLength": 1,
      "description": "Unique identifier for this transcript record."
    },
    "candidate_id": {
      "type": "string",
      "minLength": 1,
      "description": "Identifier of the candidate."
    },
    "job_id": {
      "type": "string",
      "minLength": 1,
      "description": "Identifier of the job being screened for."
    },
    "question_id": {
      "type": "string",
      "minLength": 1,
      "description": "Identifier of the HR screening question."
    },
    "timestamp": {
      "type": "string",
      "format": "date-time",
      "description": "UTC timestamp in ISO 8601 format, for example 2026-10-26T11:45:00Z."
    },
    "language": {
      "type": "string",
      "minLength": 2,
      "description": "BCP 47 language tag, such as en or ml-IN."
    },
    "transcript_text": {
      "type": "string",
      "description": "Normalized text recognized from the candidate's speech."
    },
    "confidence": {
      "type": "number",
      "minimum": 0,
      "maximum": 1,
      "description": "Speech recognition confidence score from 0 to 1, supplied by the speech recognition system."
    },
    "segments": {
      "type": "array",
      "description": "Optional ordered segments with timing and recognition metadata.",
      "items": {
        "type": "object",
        "additionalProperties": false,
        "required": [
          "text"
        ],
        "properties": {
          "text": {
            "type": "string"
          },
          "start_seconds": {
            "type": "number",
            "minimum": 0
          },
          "end_seconds": {
            "type": "number",
            "minimum": 0
          },
          "confidence": {
            "type": "number",
            "minimum": 0,
            "maximum": 1
          }
        }
      }
    },
    "normalization_version": {
      "type": "string",
      "default": "1.0",
      "description": "Version of the transcript normalization rules applied."
    },
    "source": {
      "type": "string",
      "enum": [
        "speech_to_text",
        "manual_transcription"
      ],
      "default": "speech_to_text"
    }
  }
}

