
[
  {
    "transcript_id": "TR-001",
    "candidate_id": "CAN-001",
    "job_id": "JOB-001",
    "question_id": "Q-001",
    "timestamp": "2026-10-26T06:30:00Z",
    "language": "en",
    "transcript_text": "I have three years of experience working with Python and SQL.",
    "confidence": 0.96,
    "normalization_version": "1.0",
    "source": "speech_to_text",
    "segments": [
      {
        "text": "I have three years of experience",
        "start_seconds": 0.0,
        "end_seconds": 2.1,
        "confidence": 0.97
      },
      {
        "text": "working with Python and SQL.",
        "start_seconds": 2.1,
        "end_seconds": 3.8,
        "confidence": 0.95
      }
    ]
  },
  {
    "transcript_id": "TR-002",
    "candidate_id": "CAN-002",
    "job_id": "JOB-001",
    "question_id": "Q-002",
    "timestamp": "2026-10-26T06:35:00Z",
    "language": "en",
    "transcript_text": "I built dashboards using Power BI.",
    "confidence": 0.92,
    "normalization_version": "1.0",
    "source": "speech_to_text"
  }
]
